{
  "schemaVersion": "3.0.0",
  "id": "asset-ipa-2017h29h-fe-pm-13-p68",
  "path": "assets/2017h29h-fe-pm-13-p68.webp",
  "mediaType": "image/webp",
  "sha256": "3530d2cd95955fe89bfcd777591d30e5a594641b391b32a94f9bdbd11e0c8055",
  "width": 1432,
  "height": 2026,
  "byteLength": 409094,
  "alt": "平成29年度春期 旧制度・午後 問13 原p68。問題の全本文・表・セル参照・図・マクロ・解答群を原頁のまま保持。",
  "attribution": {
    "origin": "official",
    "sourceRefs": [
      {
        "sourceId": "source-ipa-2017h29h-fe-pm-13-qs",
        "locator": {
          "section": "平成29年度 春期 基本情報技術者試験 午後 問13",
          "page": 68,
          "year": 2017,
          "period": "春期",
          "exam": "基本情報技術者試験",
          "subject": "午後",
          "timeSlot": "午後",
          "questionNumber": "13"
        }
      }
    ],
    "rightsRefs": [
      "rights-ipa-2017h29h-fe-pm-13"
    ],
    "creatorIds": [
      "ipa"
    ]
  }
}
