{
  "schemaVersion": "3.0.0",
  "id": "asset-ipa-2017h29a-fe-pm-3-p17",
  "path": "assets/2017h29a-fe-pm-3-p17.webp",
  "mediaType": "image/webp",
  "sha256": "8030fc47fe9c53dbe1f60249b7ae45175c5656e312382a9dd0c3eea695c34e47",
  "width": 1432,
  "height": 2026,
  "byteLength": 303678,
  "alt": "平成29年度秋期午後問3の原資料 physical p17。ページの全図表・解答群・注意書きは原画像で確認する。",
  "attribution": {
    "origin": "official",
    "sourceRefs": [
      {
        "sourceId": "source-ipa-2017h29a-fe-pm-3-qs",
        "locator": {
          "section": "平成29年度 秋期 基本情報技術者試験 午後 問3",
          "page": 17,
          "year": 2017,
          "period": "秋期",
          "exam": "基本情報技術者試験",
          "subject": "午後",
          "timeSlot": "午後",
          "questionNumber": "3"
        }
      }
    ],
    "rightsRefs": [
      "rights-ipa-2017h29a-fe-pm-3"
    ],
    "creatorIds": [
      "ipa"
    ]
  }
}
