{
  "schemaVersion": "3.0.0",
  "id": "asset-ipa-2017h29h-fe-pm-11-p52",
  "path": "assets/2017h29h-fe-pm-11-p52.webp",
  "mediaType": "image/webp",
  "sha256": "4a3c9b6c0a1250dfad97ec61ba5e6ea79089ba8a4d3153385461b7fce2078216",
  "width": 1432,
  "height": 2026,
  "byteLength": 369252,
  "alt": "2017春期旧午後問11 Java 原資料p52。全本文・プログラム・図表・注記・解答群を原頁のまま表示。",
  "attribution": {
    "origin": "official",
    "sourceRefs": [
      {
        "sourceId": "source-ipa-2017h29h-fe-pm-11-qs",
        "locator": {
          "section": "平成29年度 春期 基本情報技術者試験 午後 問11",
          "page": 52,
          "year": 2017,
          "period": "春期",
          "exam": "基本情報技術者試験",
          "subject": "午後",
          "timeSlot": "午後",
          "questionNumber": "11"
        }
      }
    ],
    "rightsRefs": [
      "rights-ipa-2017h29h-fe-pm-11"
    ],
    "creatorIds": [
      "ipa"
    ]
  }
}
