{
  "schemaVersion": "3.0.0",
  "id": "asset-ipa-2018h30h-fe-pm-2-p13",
  "path": "assets/2018h30h-fe-pm-2-p13.webp",
  "mediaType": "image/webp",
  "sha256": "5b77054b3971c518fd148e7815ecd9d27c4dcb014ed05bc83164176b50d3a378",
  "width": 1432,
  "height": 2026,
  "byteLength": 177726,
  "alt": "原問題物理p.13（印刷p.12）。Wx×X＋Wy×YがT以上なら1、T未満なら0。パラメタ例[0.5,0.5,0.3]の表3は00/01/10/11に対し加重和0/0.5/0.5/1、Tは0.3、出力0/1/1/1でOR。dはAND、eはNANDになるパラメタ。共用群はア[-0.5,-0.5,-0.8]、イ[-0.5,-0.5,-0.2]、ウ[0.5,0.5,-0.5]、エ[0.5,0.5,0.2]、オ[0.5,0.5,0.8]、カ[0.5,0.5,1.5]。",
  "attribution": {
    "origin": "official",
    "sourceRefs": [
      {
        "sourceId": "source-ipa-2018h30h-fe-pm-2-qs",
        "locator": {
          "section": "平成30年度 春期 基本情報技術者試験 午後 問2 原問題",
          "page": 13,
          "year": 2018,
          "period": "春期",
          "exam": "基本情報技術者試験",
          "subject": "旧制度・午後",
          "timeSlot": "午後",
          "questionNumber": "2"
        }
      }
    ],
    "rightsRefs": [
      "rights-ipa-2018h30h-fe-pm-2"
    ],
    "creatorIds": [
      "ipa"
    ]
  }
}
