{
  "schemaVersion": "3.0.0",
  "id": "asset-ipa-2023-a-5-p4",
  "path": "assets/ipa-2023-a-5-p4.webp",
  "mediaType": "image/webp",
  "sha256": "9c417b46732c1a0333e36ee2077129afa49ba393982bc0aa5e17d0f6d6cd0c14",
  "width": 903,
  "height": 405,
  "byteLength": 8390,
  "alt": "2023年度 FE科目A公開問題 問5、原文4ページ。本文・図表・解答群を含む。文字情報は画像の後の補助テキストと原本PDFで確認できる。",
  "attribution": {
    "origin": "official",
    "sourceRefs": [
      {
        "sourceId": "source-ipa-2023-a-qs",
        "locator": {
          "section": "科目A 公開問題 問5",
          "page": 4,
          "exam": "基本情報技術者試験",
          "year": 2023,
          "subject": "科目A",
          "questionNumber": "5"
        }
      }
    ],
    "rightsRefs": [
      "rights-ipa-2023-a"
    ],
    "creatorIds": [
      "ipa"
    ]
  }
}
