{
  "schemaVersion": "3.0.0",
  "id": "asset-ipa-2017h29h-fe-pm-12-p61",
  "path": "assets/2017h29h-fe-pm-12-p61.webp",
  "mediaType": "image/webp",
  "sha256": "f40c1ae7e9fa9b851dbb4bd39618ad7a39f2e00f12c5e22e14fbec3107fe6a43",
  "width": 1432,
  "height": 2026,
  "byteLength": 180454,
  "alt": "2017春期旧午後問12 原資料p61。全本文・プログラム・図・注記・解答群。",
  "attribution": {
    "origin": "official",
    "sourceRefs": [
      {
        "sourceId": "source-ipa-2017h29h-fe-pm-12-qs",
        "locator": {
          "section": "平成29年度 春期 基本情報技術者試験 午後 問12",
          "page": 61,
          "year": 2017,
          "period": "春期",
          "exam": "基本情報技術者試験",
          "subject": "午後",
          "timeSlot": "午後",
          "questionNumber": "12"
        }
      }
    ],
    "rightsRefs": [
      "rights-ipa-2017h29h-fe-pm-12"
    ],
    "creatorIds": [
      "ipa"
    ]
  }
}
