{
  "schemaVersion": "3.0.0",
  "id": "asset-ipa-sample-2022-dec-a-5-p6",
  "path": "assets/ipa-sample-2022-dec-a-5-p6.webp",
  "mediaType": "image/webp",
  "sha256": "391a4d9b693235ef58f655c499f4eb21336c8f224d20e798a24cfefc3681a58a",
  "width": 1032,
  "height": 1458,
  "byteLength": 20916,
  "alt": "2022年12月公表FE科目Aサンプル問題 問5 原資料p.6。本文・前提・図表・解答群を原ページのまま保持。補助文字と出典PDFも参照できる。",
  "attribution": {
    "origin": "official",
    "sourceRefs": [
      {
        "sourceId": "source-ipa-sample-2022-dec-a-qs",
        "locator": {
          "section": "科目A試験サンプル問題 問5",
          "page": 6,
          "exam": "基本情報技術者試験",
          "period": "2022年12月公表 サンプル問題",
          "subject": "科目A",
          "questionNumber": "5"
        }
      }
    ],
    "rightsRefs": [
      "rights-ipa-sample-2022-dec-a"
    ],
    "creatorIds": [
      "ipa"
    ]
  }
}
