{
  "schemaVersion": "3.0.0",
  "id": "asset-ipa-2017h29a-fe-pm-13-p71",
  "path": "assets/2017h29a-fe-pm-13-p71.webp",
  "mediaType": "image/webp",
  "sha256": "97097b31b8c9adf551e3ce2a6ecb0b6fcdbfbb25964e75291901a492bde35fbd",
  "width": 1432,
  "height": 2026,
  "byteLength": 408762,
  "alt": "2017年度秋期午後問13 body physical p71の原全頁。",
  "attribution": {
    "origin": "official",
    "sourceRefs": [
      {
        "sourceId": "source-ipa-2017h29a-fe-pm-13-qs",
        "locator": {
          "section": "平成29年度 秋期 基本情報技術者試験 午後 問13",
          "page": 71,
          "year": 2017,
          "period": "秋期",
          "exam": "基本情報技術者試験",
          "subject": "午後",
          "timeSlot": "午後",
          "questionNumber": "13"
        }
      }
    ],
    "rightsRefs": [
      "rights-ipa-2017h29a-fe-pm-13"
    ],
    "creatorIds": [
      "ipa"
    ]
  }
}
