{
  "schemaVersion": "3.0.0",
  "id": "asset-ipa-2017h29a-fe-pm-11-p62",
  "path": "assets/2017h29a-fe-pm-11-p62.webp",
  "mediaType": "image/webp",
  "sha256": "00ca781591100f5daca033e06cc026c77fb160019b5beb5c1d5b027d103e0cd0",
  "width": 1432,
  "height": 2026,
  "byteLength": 115662,
  "alt": "2017秋旧午後問11 原問題 p62。設問1 a〜eの全20選択肢。",
  "attribution": {
    "origin": "official",
    "sourceRefs": [
      {
        "sourceId": "source-ipa-2017h29a-fe-pm-11-qs",
        "locator": {
          "section": "平成29年度 秋期 基本情報技術者試験 午後 問11",
          "page": 62,
          "year": 2017,
          "period": "秋期",
          "exam": "基本情報技術者試験",
          "subject": "午後",
          "timeSlot": "午後",
          "questionNumber": "11"
        }
      }
    ],
    "rightsRefs": [
      "rights-ipa-2017h29a-fe-pm-11"
    ],
    "creatorIds": [
      "ipa"
    ]
  }
}
