{
  "schemaVersion": "3.0.0",
  "id": "asset-ipa-2018h30h-fe-pm-13-p84",
  "path": "assets/2018h30h-fe-pm-13-p84.webp",
  "mediaType": "image/webp",
  "sha256": "d105bdbc0b2803eb183beb4d0a74445f0e8027756bb343e8d0e836bf07a0e639",
  "width": 1432,
  "height": 2026,
  "byteLength": 472698,
  "alt": "2018年度春期 旧制度・午後 問13 表計算の仕様 物理p.84。原頁の全ての本文・図表・注記・解答群を保持。",
  "attribution": {
    "origin": "official",
    "sourceRefs": [
      {
        "sourceId": "source-ipa-2018h30h-fe-pm-13-spreadsheet",
        "locator": {
          "section": "平成30年度 春期 基本情報技術者試験 午後 問13 spreadsheet",
          "page": 84,
          "year": 2018,
          "period": "春期",
          "exam": "基本情報技術者試験",
          "subject": "旧制度・午後",
          "timeSlot": "午後",
          "questionNumber": "13"
        }
      }
    ],
    "rightsRefs": [
      "rights-ipa-2018h30h-fe-pm-13-spreadsheet"
    ],
    "creatorIds": [
      "ipa"
    ]
  }
}
