{
  "schemaVersion": "3.0.0",
  "id": "asset-ipa-2018h30h-fe-pm-12-casl-p75",
  "path": "assets/2018h30h-fe-pm-12-casl-p75.webp",
  "mediaType": "image/webp",
  "width": 1432,
  "height": 2026,
  "sha256": "3d37ea0bafcc3869c6f0bd55f2371b6518252067f8646a32f50384aa9bd6777a",
  "byteLength": 475858,
  "alt": "アセンブラの仕様 原物理p75の全頁。",
  "attribution": {
    "origin": "official",
    "sourceRefs": [
      {
        "sourceId": "source-ipa-2018h30h-fe-pm-12-casl",
        "locator": {
          "section": "平成30年度 春期 基本情報技術者試験 午後 問12／必要なアセンブラ仕様（文字符号表を含まない）",
          "page": 75,
          "year": 2018,
          "period": "春期",
          "exam": "基本情報技術者試験",
          "subject": "旧制度・午後",
          "timeSlot": "午後",
          "questionNumber": "12"
        }
      }
    ],
    "rightsRefs": [
      "rights-ipa-2018h30h-fe-pm-12-casl"
    ],
    "creatorIds": [
      "ipa"
    ]
  }
}
