{
  "schemaVersion": "3.0.0",
  "id": "asset-ipa-sample-2022-dec-a-notation-p3",
  "path": "assets/ipa-sample-2022-dec-a-0-p3.webp",
  "mediaType": "image/webp",
  "sha256": "f55d5d44a3803da585ee6201573b9df4dd12f1ec4a1b662ee0941da7bba18944",
  "width": 1032,
  "height": 1458,
  "byteLength": 9002,
  "alt": "2022年12月公表FE科目Aサンプル問題 共通の表記ルール 原資料p.3。本文・前提・図表・解答群を原ページのまま保持。補助文字と出典PDFも参照できる。",
  "attribution": {
    "origin": "official",
    "sourceRefs": [
      {
        "sourceId": "source-ipa-sample-2022-dec-a-qs",
        "locator": {
          "section": "共通の表記ルール",
          "page": 3,
          "exam": "基本情報技術者試験",
          "period": "2022年12月公表 サンプル問題",
          "subject": "科目A"
        }
      }
    ],
    "rightsRefs": [
      "rights-ipa-sample-2022-dec-a"
    ],
    "creatorIds": [
      "ipa"
    ]
  }
}
