{
  "schemaVersion": "3.0.0",
  "id": "asset-ipa-2018h30h-fe-pm-8-p40",
  "path": "assets/2018h30h-fe-pm-8-p40.webp",
  "mediaType": "image/webp",
  "sha256": "0bcad057e1da295772c4a48710a3a6c24ed79bfaa686736f7d656e893900d629",
  "width": 1432,
  "height": 2026,
  "byteLength": 223476,
  "alt": "2018年度春期 旧制度・午後 問8 原問題 物理p.40。原頁の全ての本文・図表・注記・解答群を保持。",
  "attribution": {
    "origin": "official",
    "sourceRefs": [
      {
        "sourceId": "source-ipa-2018h30h-fe-pm-8-qs",
        "locator": {
          "section": "平成30年度 春期 基本情報技術者試験 午後 問8 原問題",
          "page": 40,
          "year": 2018,
          "period": "春期",
          "exam": "基本情報技術者試験",
          "subject": "旧制度・午後",
          "timeSlot": "午後",
          "questionNumber": "8"
        }
      }
    ],
    "rightsRefs": [
      "rights-ipa-2018h30h-fe-pm-8"
    ],
    "creatorIds": [
      "ipa"
    ]
  }
}
