{
  "schemaVersion": "3.0.0",
  "id": "asset-ipa-sample-2022-dec-b-notation-p2",
  "path": "assets/ipa-sample-2022-dec-b-0-p2.webp",
  "mediaType": "image/webp",
  "sha256": "4745895f612f75fded426eed186a8233b8e7b96ca70f4cc7a6d73099a4bb46d0",
  "width": 1032,
  "height": 1458,
  "byteLength": 64878,
  "alt": "2022年12月公表FE科目Bサンプル問題 共通の疑似言語の記述形式 原資料p.2。本文・前提・図表・解答群を原ページのまま保持。補助文字と出典PDFも参照できる。",
  "attribution": {
    "origin": "official",
    "sourceRefs": [
      {
        "sourceId": "source-ipa-sample-2022-dec-b-qs",
        "locator": {
          "section": "共通の疑似言語の記述形式",
          "page": 2,
          "exam": "基本情報技術者試験",
          "period": "2022年12月公表 サンプル問題",
          "subject": "科目B"
        }
      }
    ],
    "rightsRefs": [
      "rights-ipa-sample-2022-dec-b"
    ],
    "creatorIds": [
      "ipa"
    ]
  }
}
