{
  "schemaVersion": "3.0.0",
  "id": "asset-ipa-2023-b-4-p9",
  "path": "assets/ipa-2023-b-4-p9.webp",
  "mediaType": "image/webp",
  "sha256": "4ea0ff345c390ce3d18ae86420b616592fdc9170c22b29f8fc87425592347b0c",
  "width": 902,
  "height": 284,
  "byteLength": 2280,
  "alt": "2023年度 FE科目B公開問題 問4、原文9ページ。本文・図表・解答群を含む。文字情報は画像の後の補助テキストと原本PDFで確認できる。",
  "attribution": {
    "origin": "official",
    "sourceRefs": [
      {
        "sourceId": "source-ipa-2023-b-qs",
        "locator": {
          "section": "科目B 公開問題 問4",
          "page": 8,
          "exam": "基本情報技術者試験",
          "year": 2023,
          "subject": "科目B",
          "questionNumber": "4"
        }
      }
    ],
    "rightsRefs": [
      "rights-ipa-2023-b"
    ],
    "creatorIds": [
      "ipa"
    ]
  }
}
