{
  "schemaVersion": "3.0.0",
  "id": "asset-ipa-2017h29h-fe-pm-3-p16",
  "path": "assets/ipa-2017h29h-fe-pm-3-p16.webp",
  "mediaType": "image/webp",
  "sha256": "dfaf322ab6f7d7a20ef28432590870f6cc8bd9e1a964dc9219a7841e2309707d",
  "width": 1032,
  "height": 1459,
  "byteLength": 48816,
  "alt": "原資料2017春午後問3 p16。区分IDの項目及び対象物IDの項目のUNIQUE制約。対象物IDの項目の非NULL制約。対象物IDの項目の参照制約。ルールIDの項目の主キー制約\nCHECK(登録状態 IN('未公開','公開'))。CHECK(登録状態 IS NULL)。UNIQUE('未公開','公開')。WHERE 登録状態 IN('未公開','公開')",
  "attribution": {
    "origin": "official",
    "sourceRefs": [
      {
        "sourceId": "source-ipa-2017h29h-fe-pm-3-qs",
        "locator": {
          "section": "平成29年度 春期 基本情報技術者試験 午後 問3",
          "page": 16,
          "year": 2017,
          "period": "春期",
          "exam": "基本情報技術者試験",
          "subject": "午後",
          "timeSlot": "午後",
          "questionNumber": "3"
        }
      }
    ],
    "rightsRefs": [
      "rights-ipa-2017h29h-fe-pm-3"
    ],
    "creatorIds": [
      "ipa"
    ]
  }
}
