{
  "schemaVersion": "3.0.0",
  "id": "asset-ipa-sample-2022-dec-b-6-p9",
  "path": "assets/ipa-sample-2022-dec-b-6-p9.webp",
  "mediaType": "image/webp",
  "sha256": "aa98e30f8071b98b7f50c0be72e4a0374d543468ae4abd461619974c3a6c0bb4",
  "width": 1032,
  "height": 1458,
  "byteLength": 34452,
  "alt": "2022年12月公表FE科目Bサンプル問題 問6 原資料p.9。本文・前提・図表・解答群を原ページのまま保持。補助文字と出典PDFも参照できる。",
  "attribution": {
    "origin": "official",
    "sourceRefs": [
      {
        "sourceId": "source-ipa-sample-2022-dec-b-qs",
        "locator": {
          "section": "科目B試験サンプル問題 問6",
          "page": 9,
          "exam": "基本情報技術者試験",
          "period": "2022年12月公表 サンプル問題",
          "subject": "科目B",
          "questionNumber": "6"
        }
      }
    ],
    "rightsRefs": [
      "rights-ipa-sample-2022-dec-b"
    ],
    "creatorIds": [
      "ipa"
    ]
  }
}
