{
  "schemaVersion": "3.0.0",
  "id": "asset-ipa-2017h29h-fe-pm-p3",
  "path": "assets/2017h29h-fe-pm-page-003.webp",
  "mediaType": "image/webp",
  "sha256": "9675e2ee4c08b25aa454e882c67d224bcc11c61a7e9ac17ffbf12eff5564541d",
  "width": 928,
  "height": 1313,
  "byteLength": 163978,
  "alt": "原資料p3。2017春午後の共通記法。",
  "attribution": {
    "origin": "official",
    "sourceRefs": [
      {
        "sourceId": "source-ipa-2017h29h-fe-pm-qs",
        "locator": {
          "section": "共通に使用される擬似言語の記述形式",
          "page": 3,
          "year": 2017,
          "period": "春期",
          "exam": "基本情報技術者試験",
          "timeSlot": "午後",
          "subject": "旧制度・午後",
          "questionNumber": "8"
        }
      }
    ],
    "rightsRefs": [
      "rights-ipa-2017h29h-fe-pm-common-notation"
    ],
    "creatorIds": [
      "ipa"
    ]
  }
}
