{
  "schemaVersion": "3.0.0",
  "id": "asset-array-cells",
  "path": "assets/array-cells.png",
  "mediaType": "image/png",
  "sha256": "cd203d636967263962e24e8240456a467521a6ffd7a36a917a9b0973a1533840",
  "width": 540,
  "height": 150,
  "byteLength": 2038,
  "alt": "添字1の値3、添字2の値5、添字3の値2を左から順に並べた図。",
  "attribution": {
    "origin": "original",
    "sourceRefs": [],
    "rightsRefs": [
      "rights-original"
    ],
    "creatorIds": [
      "codex"
    ]
  }
}
