{
  "schemaVersion": "3.0.0",
  "id": "asset-ipa-2017h29a-fe-pm-5-p27",
  "path": "assets/2017h29a-fe-pm-5-p27.webp",
  "mediaType": "image/webp",
  "sha256": "e8b7c3b1a5ffdc55d05cfcf02382bc751da6309b9663e4f38200b4917bdf8c52",
  "width": 1432,
  "height": 2026,
  "byteLength": 147474,
  "alt": "原資料2017秋午後問5 物理p27。bに関する解答群。ア 入金額＝充当額。イ 入金額＞充当額。ウ 入金額＜充当額。エ 充当額＝0\ncに関する解答群。ア 月間買上げ額＞0。イ 月間買上げ額＞消込額。ウ 消込額＝0。エ 消込額＞0。オ 消込額＝月間買上げ額。カ 消込額＞月間買上げ額\ndに関する解答群。ア 買上げ年月の降順。イ 買上げ年月の昇順。ウ 消込額の降順。エ 月間買上げ額の昇順。オ 得意先IDの昇順\ne，fに関する解答群。ア [月間買上げ].月間買上げ額＋[月間買上げ].消込額。イ [月間買上げ].月間買上げ額−[月間買上げ].消込額。ウ [月間買上げ].消込額−[月間買上げ].月間買上げ額。エ [入金].入金額＋[入金].充当額。オ [入金].入金額−[入金].充当額。カ [入金].充当額−[入金].入金額",
  "attribution": {
    "origin": "official",
    "sourceRefs": [
      {
        "sourceId": "source-ipa-2017h29a-fe-pm-5-qs",
        "locator": {
          "section": "平成29年度 秋期 基本情報技術者試験 午後 問5",
          "page": 27,
          "year": 2017,
          "period": "秋期",
          "exam": "基本情報技術者試験",
          "subject": "午後",
          "timeSlot": "午後",
          "questionNumber": "5"
        }
      }
    ],
    "rightsRefs": [
      "rights-ipa-2017h29a-fe-pm-5"
    ],
    "creatorIds": [
      "ipa"
    ]
  }
}
