{
  "schemaVersion": "3.0.0",
  "id": "asset-ipa-2018h30h-fe-pm-2-p11",
  "path": "assets/2018h30h-fe-pm-2-p11.webp",
  "mediaType": "image/webp",
  "sha256": "aae4712795727bf502c27917a1dd2bbce4bfa8119b006e9c0eac159ed0623def",
  "width": 1432,
  "height": 2026,
  "byteLength": 237736,
  "alt": "原問題物理p.11（印刷p.10）。問2から問7の6問から4問を選択する。選択欄のマークが必要で、5問以上なら先頭4問を採点。問2は論理回路に関する設問1〜3。表1の入力2列とAND/OR/NAND/NOR出力は、00で0/0/1/1、01で0/1/1/0、10で0/1/1/0、11で1/1/0/0。設問1はXORを作る図1中の矩形に入れる答えを選ぶ。表2は入力00/01/10/11に対するXOR出力0/1/1/0。",
  "attribution": {
    "origin": "official",
    "sourceRefs": [
      {
        "sourceId": "source-ipa-2018h30h-fe-pm-2-qs",
        "locator": {
          "section": "平成30年度 春期 基本情報技術者試験 午後 問2 原問題",
          "page": 11,
          "year": 2018,
          "period": "春期",
          "exam": "基本情報技術者試験",
          "subject": "旧制度・午後",
          "timeSlot": "午後",
          "questionNumber": "2"
        }
      }
    ],
    "rightsRefs": [
      "rights-ipa-2018h30h-fe-pm-2"
    ],
    "creatorIds": [
      "ipa"
    ]
  }
}
