{
  "schemaVersion": "3.0.0",
  "id": "asset-ipa-sample-2022-apr-b-1-p2",
  "path": "assets/ipa-sample-2022-apr-b-1-p2.webp",
  "mediaType": "image/webp",
  "sha256": "23915e74959e655c8c3c00a5fce3fb72ab80baa9664b5e741e3d17fd437227f6",
  "width": 1191,
  "height": 1684,
  "byteLength": 32192,
  "alt": "2022年4月公表FE科目Bサンプル問題 問1 原資料p.2。本文・前提・図表・解答群を原ページのまま保持。補助文字と出典PDFも参照できる。",
  "attribution": {
    "origin": "official",
    "sourceRefs": [
      {
        "sourceId": "source-ipa-sample-2022-apr-b-qs",
        "locator": {
          "section": "科目B試験サンプル問題 問1",
          "page": 2,
          "exam": "基本情報技術者試験",
          "period": "2022年4月公表 サンプル問題",
          "subject": "科目B",
          "questionNumber": "1"
        }
      }
    ],
    "rightsRefs": [
      "rights-ipa-sample-2022-apr-b"
    ],
    "creatorIds": [
      "ipa"
    ]
  }
}
