{
  "schemaVersion": "3.0.0",
  "id": "asset-ipa-2017h29h-fe-pm-13-p83",
  "path": "assets/2017h29h-fe-pm-13-p83.webp",
  "mediaType": "image/webp",
  "sha256": "16bbefd7db1ac3265224ffbb2a4f375b3ad26808562102f445fa06f4b0e48eb8",
  "width": 1432,
  "height": 2026,
  "byteLength": 271480,
  "alt": "平成29年度春期 午後 表計算ソフトの機能・用語 原p83。原の記法、関数・マクロの全定義と注記を保持。",
  "attribution": {
    "origin": "official",
    "sourceRefs": [
      {
        "sourceId": "source-ipa-2017h29h-fe-pm-13-qs",
        "locator": {
          "section": "平成29年度 春期 基本情報技術者試験 午後 付属資料 表計算ソフトの機能・用語",
          "page": 83,
          "year": 2017,
          "period": "春期",
          "exam": "基本情報技術者試験",
          "subject": "午後",
          "timeSlot": "午後",
          "questionNumber": "13"
        }
      }
    ],
    "rightsRefs": [
      "rights-ipa-2017h29h-fe-pm-13-spreadsheet-instructions"
    ],
    "creatorIds": [
      "ipa"
    ]
  }
}
