{
  "schemaVersion": "3.0.0",
  "id": "asset-ipa-2017h29a-fe-pm-13-p90",
  "path": "assets/2017h29a-fe-pm-13-p90.webp",
  "mediaType": "image/webp",
  "sha256": "b0459ad2536d08d793bb6c274989cec4372098ded1099191525110f9a40b1a33",
  "width": 1432,
  "height": 2026,
  "byteLength": 278720,
  "alt": "2017年度秋期午後問13 spreadsheet physical p90の原全頁。",
  "attribution": {
    "origin": "official",
    "sourceRefs": [
      {
        "sourceId": "source-ipa-2017h29a-fe-pm-13-spreadsheet",
        "locator": {
          "section": "平成29年度 秋期 基本情報技術者試験 午後 問13 表計算ソフトの機能・用語",
          "page": 90,
          "year": 2017,
          "period": "秋期",
          "exam": "基本情報技術者試験",
          "subject": "午後",
          "timeSlot": "午後",
          "questionNumber": "13"
        }
      }
    ],
    "rightsRefs": [
      "rights-ipa-2017h29a-fe-pm-13-spreadsheet"
    ],
    "creatorIds": [
      "ipa"
    ]
  }
}
